{
  "subset_id": "HITL-WS-V1",
  "version": "1.0.1",
  "title": "永生史第一版作品子集",
  "created_at": "2026-08-07T12:00:00Z",
  "description": "从 2583 条 draft 事件中选择 399 条作为第一版作品子集，覆盖全部本地时期、路径族、事件类型与证据等级，并优先收录转折点和日期精确事件。",
  "selection_criteria": [
    "覆盖全部本地时期，不把作品正文局限于 21 世纪技术事件。",
    "覆盖 8 个路径族和主要事件类型，保留神话、思想、失败与制度线索。",
    "优先收录 significance=turning_point、日期精确、来源数量较多的可复核事件。",
    "排除已知未绑定正文、不可访问或 blocked 来源。",
    "当前只表示入选，不表示复核；verification_status 必须单独推进。"
  ],
  "reviewed_event_count": 31,
  "fresh_reviewed_event_count": 0,
  "event_ids": [
    "HIT-DEM-001",
    "HIT-DEM-002",
    "HIT-DEM-005",
    "HIT-DEM-006",
    "HIT-DEM-008",
    "HIT-DEM-009",
    "HIT-DEM-010",
    "HIT-DEM-011",
    "HIT-FAI-001",
    "HIT-FAI-002",
    "HIT-FAI-003",
    "HIT-FAI-004",
    "HIT-FAI-005",
    "HIT-FAI-006",
    "HIT-FAI-008",
    "HIT-FAI-009",
    "HIT-FAI-011",
    "HIT-FAI-012",
    "HIT-FAI-013",
    "HIT-INS-001",
    "HIT-INS-006",
    "HIT-INS-008",
    "HIT-INS-016",
    "HIT-INS-017",
    "HIT-INS-021",
    "HIT-INS-023",
    "HIT-INS-031",
    "HIT-INS-032",
    "HIT-INS-033",
    "HIT-INS-036",
    "HIT-INS-037",
    "HIT-INS-038",
    "HIT-INS-042",
    "HIT-INS-043",
    "HIT-INS-044",
    "HIT-INS-045",
    "HIT-INS-046",
    "HIT-INS-047",
    "HIT-INS-048",
    "HIT-INS-049",
    "HIT-INS-050",
    "HIT-INS-052",
    "HIT-INS-056",
    "HIT-INS-057",
    "HIT-INS-076",
    "HIT-INS-077",
    "HIT-INS-078",
    "HIT-INS-079",
    "HIT-INS-080",
    "HIT-LIT-001",
    "HIT-LIT-002",
    "HIT-LIT-003",
    "HIT-LIT-004",
    "HIT-LIT-005",
    "HIT-LIT-006",
    "HIT-LIT-007",
    "HIT-LIT-008",
    "HIT-LIT-009",
    "HIT-LIT-010",
    "HIT-LIT-011",
    "HIT-LIT-012",
    "HIT-LIT-013",
    "HIT-LIT-015",
    "HIT-LIT-016",
    "HIT-LIT-017",
    "HIT-LIT-018",
    "HIT-LIT-019",
    "HIT-LIT-020",
    "HIT-LIT-021",
    "HIT-LIT-022",
    "HIT-LIT-023",
    "HIT-LIT-024",
    "HIT-MTH-001",
    "HIT-MTH-002",
    "HIT-MTH-003",
    "HIT-MTH-004",
    "HIT-MTH-005",
    "HIT-MTH-006",
    "HIT-MTH-007",
    "HIT-MTH-008",
    "HIT-MTH-009",
    "HIT-MTH-010",
    "HIT-MTH-011",
    "HIT-MTH-012",
    "HIT-MTH-013",
    "HIT-MTH-014",
    "HIT-POL-007",
    "HIT-POL-008",
    "HIT-POL-009",
    "HIT-POL-010",
    "HIT-POL-014",
    "HIT-POL-015",
    "HIT-POL-016",
    "HIT-POL-017",
    "HIT-POL-018",
    "HIT-POL-019",
    "HIT-POL-022",
    "HIT-POL-023",
    "HIT-POL-024",
    "HIT-POL-025",
    "HIT-POL-026",
    "HIT-POL-029",
    "HIT-POL-032",
    "HIT-POL-033",
    "HIT-POL-037",
    "HIT-POL-038",
    "HIT-POL-047",
    "HIT-POL-048",
    "HIT-POL-049",
    "HIT-POL-050",
    "HIT-POL-051",
    "HIT-POL-052",
    "HIT-POL-053",
    "HIT-POL-054",
    "HIT-POL-055",
    "HIT-POL-056",
    "HIT-POL-057",
    "HIT-POL-062",
    "HIT-POL-063",
    "HIT-POL-064",
    "HIT-POL-065",
    "HIT-POL-066",
    "HIT-POL-067",
    "HIT-POL-068",
    "HIT-POL-069",
    "HIT-POL-070",
    "HIT-POL-072",
    "HIT-POL-073",
    "HIT-POL-074",
    "HIT-POL-075",
    "HIT-POL-076",
    "HIT-POL-077",
    "HIT-POL-078",
    "HIT-POL-079",
    "HIT-POL-080",
    "HIT-POL-081",
    "HIT-POL-082",
    "HIT-POL-083",
    "HIT-POL-084",
    "HIT-POL-085",
    "HIT-POL-086",
    "HIT-POL-087",
    "HIT-POL-088",
    "HIT-POL-089",
    "HIT-POL-090",
    "HIT-POL-091",
    "HIT-PRA-001",
    "HIT-PRA-002",
    "HIT-PRA-003",
    "HIT-PRA-004",
    "HIT-PRA-005",
    "HIT-PRA-006",
    "HIT-PRA-007",
    "HIT-PRA-009",
    "HIT-PRA-011",
    "HIT-PRA-014",
    "HIT-PRA-018",
    "HIT-SCI-001",
    "HIT-SCI-002",
    "HIT-SCI-003",
    "HIT-SCI-004",
    "HIT-SCI-005",
    "HIT-SCI-006",
    "HIT-SCI-007",
    "HIT-SCI-014",
    "HIT-SCI-017",
    "HIT-SCI-018",
    "HIT-SCI-019",
    "HIT-SCI-020",
    "HIT-SCI-021",
    "HIT-SCI-022",
    "HIT-SCI-023",
    "HIT-SCI-024",
    "HIT-SCI-025",
    "HIT-SCI-026",
    "HIT-SCI-027",
    "HIT-SCI-028",
    "HIT-SCI-029",
    "HIT-SCI-030",
    "HIT-SCI-031",
    "HIT-SCI-032",
    "HIT-SCI-033",
    "HIT-SCI-035",
    "HIT-SCI-036",
    "HIT-SCI-037",
    "HIT-SCI-038",
    "HIT-SCI-039",
    "HIT-SCI-040",
    "HIT-SCI-041",
    "HIT-SCI-042",
    "HIT-SCI-043",
    "HIT-SCI-047",
    "HIT-SCI-053",
    "HIT-SCI-054",
    "HIT-SCI-055",
    "HIT-SCI-056",
    "HIT-SCI-057",
    "HIT-SCI-058",
    "HIT-SCI-059",
    "HIT-SCI-060",
    "HIT-SCI-061",
    "HIT-SCI-062",
    "HIT-SCI-063",
    "HIT-SCI-064",
    "HIT-SCI-065",
    "HIT-SCI-066",
    "HIT-SCI-067",
    "HIT-SCI-068",
    "HIT-SCI-069",
    "HIT-SCI-070",
    "HIT-SCI-071",
    "HIT-SCI-072",
    "HIT-SCI-073",
    "HIT-SCI-074",
    "HIT-TEC-001",
    "HIT-TEC-002",
    "HIT-TEC-003",
    "HIT-TEC-004",
    "HIT-TEC-005",
    "HIT-TEC-007",
    "HIT-TEC-009",
    "HIT-TEC-013",
    "HIT-TEC-014",
    "HIT-TEC-015",
    "HIT-TEC-017",
    "HIT-TEC-018",
    "HIT-TEC-019",
    "HIT-TEC-020",
    "HIT-TEC-021",
    "HIT-TEC-022",
    "HIT-TEC-023",
    "HIT-TEC-024",
    "HIT-TEC-025",
    "HIT-TEC-026",
    "HIT-TEC-027",
    "HIT-TEC-028",
    "HIT-TEC-029",
    "HIT-TEC-030",
    "HIT-TEC-031",
    "HIT-TEC-032",
    "HIT-TEC-035",
    "HIT-TEC-036",
    "HIT-TEC-042",
    "HIT-TEC-043",
    "HIT-TEC-044",
    "HIT-TEC-045",
    "HIT-TEC-046",
    "HIT-TEC-047",
    "HIT-TEC-048",
    "HIT-TEC-049",
    "HIT-TEC-050",
    "HIT-TEC-051",
    "HIT-TEC-052",
    "HIT-TEC-053",
    "HIT-TEC-055",
    "HIT-TEC-056",
    "HIT-TEC-057",
    "HIT-TEC-058",
    "HIT-TEC-061",
    "HIT-TEC-065",
    "HIT-TEC-067",
    "HIT-TEC-073",
    "HIT-TEC-084",
    "HIT-TEC-085",
    "HIT-TEC-086",
    "HIT-TEC-1030",
    "HIT-TEC-1031",
    "HIT-TEC-1033",
    "HIT-TEC-1091",
    "HIT-TEC-469",
    "HIT-TEC-704",
    "HIT-TEC-769",
    "HIT-TEC-883",
    "HIT-TEC-904",
    "HIT-TEC-910",
    "HIT-TEC-943",
    "HIT-TEC-969",
    "HIT-TEC-991",
    "HIT-TEC-993",
    "HIT-THT-001",
    "HIT-THT-002",
    "HIT-THT-003",
    "HIT-THT-004",
    "HIT-THT-005",
    "HIT-THT-006",
    "HIT-THT-007",
    "HIT-THT-008",
    "HIT-THT-009",
    "HIT-THT-010",
    "HIT-THT-011",
    "HIT-THT-012",
    "HIT-THT-013",
    "HIT-THT-014",
    "HIT-THT-015",
    "HIT-THT-017",
    "HIT-THT-018",
    "HIT-THT-019",
    "HIT-THT-020",
    "HIT-THT-022",
    "HIT-THT-023",
    "HIT-THT-024",
    "HIT-THT-025",
    "HIT-THT-027",
    "HIT-THT-028",
    "HIT-THT-029",
    "HIT-THT-030",
    "HIT-THT-031",
    "HIT-THT-032",
    "HIT-THT-033",
    "HIT-THT-034",
    "HIT-THT-035",
    "HIT-THT-036",
    "HIT-THT-037",
    "HIT-THT-038",
    "HIT-THT-039",
    "HIT-THT-041",
    "HIT-THT-042",
    "HIT-THT-043",
    "HIT-THT-045",
    "HIT-THT-046",
    "HIT-THT-047",
    "HIT-THT-048",
    "HIT-THT-049",
    "HIT-THT-050",
    "HIT-THT-051",
    "HIT-THT-054",
    "HIT-THT-055",
    "HIT-THT-056",
    "HIT-THT-057",
    "HIT-THT-058",
    "HIT-THT-059",
    "HIT-THT-060",
    "HIT-THT-062",
    "HIT-THT-063",
    "HIT-THT-064",
    "HIT-THT-065",
    "HIT-THT-066",
    "HIT-THT-073",
    "HIT-THT-074",
    "HIT-THT-075",
    "HIT-THT-076",
    "HIT-THT-077",
    "HIT-THT-078",
    "HIT-THT-079",
    "HIT-THT-080",
    "HIT-THT-081",
    "HIT-THT-268",
    "HIT-THT-269",
    "HIT-THT-270",
    "HIT-THT-271",
    "HIT-THT-272",
    "HIT-THT-293",
    "HIT-THT-294",
    "HIT-THT-295",
    "HIT-THT-296",
    "HIT-THT-297",
    "HIT-THT-387",
    "HIT-THT-398",
    "HIT-THT-399",
    "HIT-THT-400",
    "HIT-THT-401",
    "HIT-THT-402",
    "HIT-THT-408",
    "HIT-THT-409",
    "HIT-THT-412",
    "HIT-THT-416",
    "HIT-THT-417",
    "HIT-THT-418",
    "HIT-THT-419",
    "HIT-THT-421",
    "HIT-THT-453",
    "HIT-THT-461",
    "HIT-THT-469",
    "HIT-THT-473",
    "HIT-THT-477",
    "HIT-THT-483",
    "HIT-THT-499",
    "HIT-THT-500",
    "HIT-THT-522",
    "HIT-THT-535",
    "HIT-THT-536",
    "HIT-THT-537",
    "HIT-THT-538",
    "HIT-THT-540",
    "HIT-THT-542",
    "HIT-THT-544",
    "HIT-THT-545",
    "HIT-THT-546",
    "HIT-THT-547",
    "HIT-THT-548",
    "HIT-THT-549",
    "HIT-THT-550",
    "HIT-THT-551",
    "HIT-THT-552",
    "HIT-THT-553",
    "HIT-THT-554",
    "HIT-THT-555",
    "HIT-THT-556",
    "HIT-THT-557"
  ],
  "stats": {
    "total_selected": 399,
    "pre_modern_selected": 196,
    "modern_selected": 203,
    "by_period": {
      "period-19th-century": 11,
      "period-20th-century": 138,
      "period-21st-century": 203,
      "period-mesopotamia-second-millennium-bce": 1,
      "period-ming-qing-literature": 1,
      "period-early-modern-europe": 6,
      "period-latin-medieval": 3,
      "period-medieval-tibet": 1,
      "period-ancient-egypt-old-kingdom": 1,
      "period-zoroastrian-formation": 1,
      "period-early-christianity": 1,
      "period-early-islamic": 1,
      "period-archaic-mediterranean": 1,
      "period-archaic-greece": 2,
      "period-warring-states-han": 4,
      "period-ancient-egypt-new-kingdom": 2,
      "period-classical-greece": 2,
      "period-late-antiquity": 3,
      "period-classical-india": 2,
      "period-qin-dynasty": 1,
      "period-ayurveda-classical": 1,
      "period-late-antique-alchemy": 1,
      "period-tang-song-china": 1,
      "period-enlightenment": 4,
      "period-medieval-islamic-world": 1,
      "period-vedic-upanishadic": 1,
      "period-early-buddhist": 1,
      "period-eastern-jin": 1,
      "period-abbasid": 1,
      "period-roman-republic": 1,
      "period-roman-empire": 1
    },
    "by_path_family": {
      "maintenance": 78,
      "social_composite": 75,
      "reconstruction": 69,
      "cross_path": 20,
      "cognitive_extension": 28,
      "philosophical": 85,
      "suspension": 16,
      "digital_migration": 28
    },
    "by_event_type": {
      "demographic": 9,
      "failure": 11,
      "institution": 30,
      "literature": 23,
      "religious": 11,
      "myth": 4,
      "policy": 60,
      "practice": 18,
      "technology": 114,
      "thought": 119
    },
    "by_evidence_grade": {
      "T": 93,
      "S": 92,
      "L": 11,
      "I": 191,